{
  "operation_id": "88888888-8888-4888-8888-888888888888",
  "proposal_id": "11111111-1111-4111-8111-111111111111",
  "phase": "execute",
  "proposal_revision": 1,
  "payload_hash": "025b6f8ab0826324bbcbc4d2d3d7e92a492735931c4543639bb96e043726475c",
  "device_id_hash": "bbbbbbbbbbbbbbbbbbbbbbbbbbbbbbbbbbbbbbbbbbbbbbbbbbbbbbbbbbbbbbbb",
  "status": "claimed",
  "lease_id": "55555555-5555-4555-8555-555555555555",
  "issued_at": "2026-08-26T10:06:00.000Z",
  "expires_at": "2026-08-26T10:08:00.000Z",
  "receipt_id": null
}
